Key,English,French
d11ChatBlanc1.Start1,"Okay, I warmed up.","Ok, je me suis bien échauffé."
d11ChatBlanc2.Start2,Let's the fun begin before I destroy you !,Je vais pouvoir m'amuser un peu avant de vous anéantir !
d11ChatNoir1.Start1,"Wait a second, ""I warmed up"" ?","Comment ça ""je me suis bien échauffé"" ?"
d11ChatNoir1.Start2,He broke at least 20 of my ribs.,Il m'a cassé au moins 20 côtes.
d11ChatNoir1.Start3,"I almost got cataclysmed 72 TIMES, and he's just WARMED UP ?","J'ai failli me faire cataclysmer 72 FOIS, et il est juste CHAUD ?"
d11ChatBlanc1.Start3,That's what it takes to please my lady.,Il faut bien ça pour plaire à ma lady.
d11ChatBlanc2.Start4,Isn't it Mari-,N'est-ce pas Mari-
d11LadyBug4.Start1,WARDQZDQDZZNINGCATNOIRHEISGOINGSTRAIGHTONUS!!!!!!!,ATTDQZDQDZZENTIONCHATNOIRILFONCEDROITSURNOUS!!!!!!!