Key,English,French
dLadyBug1.Start1,Cat blanc is too strong now.,Chat blanc est devenu trop fort.
dLadyBug1.Start2,We need to weaken him first or it's over.,Il faut d'abord l'affaiblir si on veut avoir une chance.
dLadyBug1.Start3,My lucky charm can reveal the weak points of his attacks.,Mon lucky charm peut révéler les points faibles de ses attaques.
dChatBlanc1.Start4,Everything will be fine my lady.,Tout se passera bien ma lady.
dChatBlanc2.Start5,You just have to GIVE ME YOUR MIRACULOUS !,Il faut juste que tu me DONNES TON MIRACULOUS !
dChatNoir1.Start6,"Needless to say, even in white I'm pawesome !","Y'a pas à dire, même en blanc j'ai un chat-rme fou !"
dLadyBug1.Start7,"This is not the time, kitten.",C'est pas le moment chaton.