Key,English,French
d2LadyBug1.Start1,I don't have enough information about Chat Blanc.,Je n'ai pas assez d'informations sur Chat Blanc.
d2LadyBug1.Start2,We must first study his movements.,Il faut d'abord étudier ses mouvements.
d2ChatNoir2.Start3,I know some sick moves if you want my lady!,Je peux te faire quelques pas de danses si tu veux ma lady!
d2LadyBug1.Start4,Why not a dance fight too.,Pourquoi pas une battle de danse aussi.
d2ChatNoir1.Start5,That's an idea! ,Ça c'est une idée! 
d2ChatNoir2.Start6,We could dance fight him to the death!,On pourrait le battle danser jusqu'à ce qu'il s'écroule de fatigue !